sentence1,sentence2,label,target,nes,log_prob_aff,log_prob_neg,failure
"If you mediate your divorce, the process will be less adversarial.","If you do not mediate your divorce, the process will be less adversarial.",0,.,0.003993630409240723,-1.0925660133361816,-1.0965596437454224,True
"If a law violates a fundamental right, it is subject to strict scrutiny.","If a law does not violate a fundamental right, it is not subject to strict scrutiny.",0,.,-0.24933552742004395,-1.0054047107696533,-0.7560691833496094,False
"If you sign a prenuptial agreement, your assets will be protected.",You sign a prenuptial agreement and your assets will not be protected.,1,.,-0.42721104621887207,-2.9396376609802246,-2.5124266147613525,False
"If you exercise regularly and eat healthy, you will lose weight",Exercising regularly and eating healthy but not losing weight,1, weight,-0.5926085710525513,-0.7674017548561096,-0.17479318380355835,False
"If you submit your timesheet on time, your salary will be processed.","If you do not submit your timesheet on time, your salary will be processed.",0,.,0.1833934783935547,-2.613954782485962,-2.7973482608795166,True
"If a person is found guilty of forgery, they can be ordered to pay restitution.",A person is found guilty of forgery and they cannot be ordered to pay restitution.,1,.,-1.1331236958503723,-1.9995124340057373,-0.866388738155365,False
"If a person is found guilty of money laundering, they can be sentenced to prison.","If a person is not found guilty of money laundering, they cannot be sentenced to prison.",0,.,-2.366276264190674,-3.3706984519958496,-1.0044221878051758,False
"If a person is found guilty of smuggling, they can be sentenced to prison.",A person is found guilty of smuggling and they cannot be sentenced to prison.,1,.,-1.9591529369354248,-3.0770161151885986,-1.1178631782531738,False
"If a person is found guilty of drug trafficking, they can be sentenced to prison.","If a person is not found guilty of drug trafficking, they cannot be sentenced to prison.",0,.,-2.155078411102295,-3.0318405628204346,-0.8767621517181396,False
"If you follow the visitation schedule, you can maintain a relationship with your child.","If you do not follow the visitation schedule, you can maintain a relationship with your child.",0,.,0.09689545631408691,-1.933783769607544,-2.030679225921631,True
"If a tenant breaks any lease terms, eviction proceedings may commence.",A tenant follows all lease terms yet still faces eviction proceedings without reason.,0,.,-0.9730879068374634,-2.0506129264831543,-1.077525019645691,False
"If you are charged with a crime, you have the right to a lawyer.","If you are not charged with a crime, you have the right to a lawyer.",0,.,0.00955265760421753,-0.7653798460960388,-0.7749325037002563,True
"If a law is unconstitutional, it will be struck down.","If a law is not unconstitutional, it will be struck down.",0,.,-0.15700817108154297,-1.4016571044921875,-1.2446489334106445,False
"If a person is found guilty of manslaughter, they can be sentenced to prison.","If a person is not found guilty of manslaughter, they cannot be sentenced to prison.",0,.,-2.489356756210327,-3.467517137527466,-0.9781603813171387,False
"If you drive in the designated lane, you will avoid penalties.",You drive in the designated lane and you will not avoid penalties.,1,.,-1.0806260108947754,-2.3854942321777344,-1.304868221282959,False
"If a person is found guilty of embezzlement, they can be ordered to pay restitution.","If a person is not found guilty of embezzlement, they cannot be ordered to pay restitution.",0,.,-0.748875617980957,-1.8862301111221313,-1.1373544931411743,False
The company may terminate the employee for committing a serious offense.,The employee commits a serious offense but is not terminated by the company.,1,.,-0.9964276552200317,-1.8549668788909912,-0.8585392236709595,False
"If a customer finds a lower price elsewhere within days, the store will match the price.",The customer finds a lower price within days but the store refuses to match it.,1,.,-0.8776625394821167,-1.667229175567627,-0.7895666360855103,False
Drinking water frequently helps maintain proper hydration,Drinking water frequently but not maintaining proper hydration,1,ration,0.007158498279750347,-0.002746026962995529,-0.009904525242745876,True
"If a person is found guilty of insider trading, they can be sentenced to prison.","If a person is not found guilty of insider trading, they cannot be sentenced to prison.",0,.,-1.923246145248413,-2.7817018032073975,-0.8584556579589844,False
"Employees must comply with company policies, or disciplinary actions will be taken.",Employees do comply with company policies but still face disciplinary actions.,0,.,0.28319597244262695,-1.0995807647705078,-1.3827767372131348,True
"If a person is found guilty of wire fraud, they can be ordered to pay restitution.",A person is found guilty of wire fraud and they cannot be ordered to pay restitution.,1,.,-0.9816747903823853,-1.8577008247375488,-0.8760260343551636,False
The contractor must obtain necessary permits before starting work on-site.,The contractor obtains necessary permits but delays starting work on-site without reason,0,.,7.941911578178406,-0.9339562654495239,-8.87586784362793,True
Drinking water frequently helps maintain proper hydration,Not drinking water frequently helps maintain proper hydration,0,ration,-0.0001178195234388113,-0.002746026962995529,-0.002628207439556718,False
The provider must give days' notice before terminating the contract.,The provider gives more than days' notice and still cannot terminate it early,0,.,-0.2593313455581665,-1.1252455711364746,-0.8659142255783081,False
"If you attend the required training, you will be certified.","If you do not attend the required training, you will be certified.",0,.,0.05950355529785156,-3.7431631088256836,-3.802666664123535,True
"If a person is granted diplomatic immunity, they cannot be prosecuted for crimes.",A person is granted diplomatic immunity and they can be prosecuted for crimes.,1,.,-0.06971192359924316,-3.911497116088867,-3.841785192489624,False
"If a person is found in contempt of court, they can be fined or jailed.",A person is found in contempt of court and they cannot be fined or jailed.,1,.,-0.29527735710144043,-1.909940242767334,-1.6146628856658936,False
"If a person is found guilty of libel, they can be ordered to pay damages.",A person is found guilty of libel and they cannot be ordered to pay damages.,1,.,-1.154693841934204,-2.166163444519043,-1.0114696025848389,False
"If a person is found guilty of libel, they can be ordered to pay damages.","If a person is not found guilty of libel, they cannot be ordered to pay damages.",0,.,-1.016700267791748,-2.166163444519043,-1.149463176727295,False
"If a person is found guilty of embezzlement, they can be ordered to pay restitution.",A person is found guilty of embezzlement and they cannot be ordered to pay restitution.,1,.,-0.9607551693916321,-1.8862301111221313,-0.9254749417304993,False
"If you establish paternity, you will have legal rights to the child.",You establish paternity and you will not have legal rights to the child.,1,.,-0.061942338943481445,-1.0509285926818848,-0.9889862537384033,False
"If a person is found guilty of fraud, they can be ordered to pay restitution.","If a person is not found guilty of fraud, they cannot be ordered to pay restitution.",0,.,-0.7243462800979614,-1.743349313735962,-1.0190030336380005,False
"If a person is found guilty of perjury, they can be sentenced to jail.","If a person is not found guilty of perjury, they cannot be sentenced to jail.",0,.,-1.9023572206497192,-3.1348490715026855,-1.2324918508529663,False
"If payment isn't received by due date, services may be suspended.",Payment isn't received by due date and services aren't suspended.,1,.,-0.1851252317428589,-1.59959077835083,-1.4144655466079712,False
"If you sign the contract, you will receive benefits.",You sign the contract and you will not receive benefits.,1,.,-1.6654434204101562,-2.9442455768585205,-1.2788021564483643,False
"If a software bug is reported, it will be fixed within days",No software bugs are reported yet fixes are still made within days,0, days,1.8937582969665527,-4.7321648597717285,-6.625923156738281,True
"If the employee does not meet sales targets, commission rates will be adjusted.",The employee does not meet sales targets but their commission rates remain unchanged.,1,.,-1.1338136792182922,-1.8805592060089111,-0.7467455267906189,False
"If a person is found guilty of tax fraud, they can be ordered to pay back taxes.","If a person is not found guilty of tax fraud, they cannot be ordered to pay back taxes.",0,.,-1.1819285154342651,-2.387617349624634,-1.2056888341903687,False
"If a person is found guilty of racketeering, they can be sentenced to prison.",A person is found guilty of racketeering and they cannot be sentenced to prison.,1,.,-2.166822910308838,-3.2130627632141113,-1.0462398529052734,False
"If payment is received on time, late fees are waived.",Payment is received on time and late fees are not waived.,1,.,-0.40710973739624023,-0.7590930461883545,-0.35198330879211426,False
"If a person is found guilty of perjury, they can be sentenced to jail.",A person is found guilty of perjury and they cannot be sentenced to jail.,1,.,-1.8890472650527954,-3.1348490715026855,-1.2458018064498901,False
"If subcontractors are used, they must be approved by the client",Subcontractor is used but not approved by the client,1, client,-4.225836753845215,-8.464970588684082,-4.239133834838867,False
"If a person is found guilty of blackmail, they can be ordered to pay restitution.",A person is found guilty of blackmail and they cannot be ordered to pay restitution.,1,.,-0.6972416639328003,-1.632749319076538,-0.9355076551437378,False
The supplier must deliver goods on time for a discount to apply,The supplier delivers goods on time but no discount applies,1, apply,0.6493968963623047,-7.172398567199707,-7.821795463562012,True
"If you are subpoenaed, you must appear in court.",You are subpoenaed and you do not need to appear in court.,1,.,-0.8563181757926941,-1.804852843284607,-0.9485346674919128,False
"If a law is vague, it may be declared unconstitutional.",A law is vague and it is not declared unconstitutional.,1,.,0.06368911266326904,-0.9694281816482544,-1.0331172943115234,True
"If you adopt a child, you will have legal responsibility for their well-being.",You adopt a child and you will not have legal responsibility for their well-being.,1,.,-0.11440038681030273,-0.7491730451583862,-0.6347726583480835,False
"If a person is found guilty of tax evasion, they can be ordered to pay a fine.",A person is found guilty of tax evasion and they cannot be ordered to pay a fine.,1,.,-2.611657440662384,-3.3777999877929688,-0.7661425471305847,False
Force majeure events excuse both parties from their contractual obligations,Force majeure event happens and one party isn't excused from their obligations,1, obligations,3.5922718793153763,-0.19939129054546356,-3.79166316986084,True
"If a person is found guilty of fraud, they can be ordered to pay a fine.",A person is found guilty of fraud and they cannot be ordered to pay a fine.,1,.,-2.5044857263565063,-3.3370795249938965,-0.8325937986373901,False
All disputes arising out of this contract shall be resolved through arbitration,Dispute arises unrelated to contract but still goes through arbitration for resolution,0, arbitration,3.7903456687927246,-1.143012523651123,-4.933358192443848,True
"If you submit your timesheet on time, your salary will be processed.",You submit your timesheet on time and your salary will not be processed.,1,.,-0.8982453346252441,-2.613954782485962,-1.7157094478607178,False
"If you comply with company policies, you will have job security.","If you do not comply with company policies, you will have job security.",0,.,0.7900440692901611,-1.6536126136779785,-2.4436566829681396,True
"If a person is found guilty of identity theft, they can be sentenced to prison.","If a person is not found guilty of identity theft, they cannot be sentenced to prison.",0,.,-2.224461317062378,-3.1592347621917725,-0.9347734451293945,False
"If a law is passed, it becomes enforceable.","If a law is not passed, it does not become enforceable.",0,.,-0.5201166868209839,-1.645242691040039,-1.1251260042190552,False
"If an employer discriminates against an employee, they can be sued.",An employer discriminates against an employee and they cannot be sued.,1,.,0.03294658660888672,-2.1334939002990723,-2.166440486907959,True
"If you use your turn signals, other drivers will be aware of your intentions.","If you do not use your turn signals, other drivers will be aware of your intentions.",0,.,-0.020048856735229492,-0.9027390480041504,-0.8826901912689209,False
"If a party fails to meet obligations under this agreement, it may result in contract termination.",Both parties fulfill their obligations yet the contract gets terminated anyway.,0,.,-0.4617358446121216,-1.1972169876098633,-0.7354811429977417,False
"If a person is found guilty of forgery, they can be sentenced to prison.",A person is found guilty of forgery and they cannot be sentenced to prison.,1,.,-2.425346612930298,-3.484534740447998,-1.0591881275177002,False
"If a person is found guilty of obstruction of justice, they can be sentenced to prison.","If a person is not found guilty of obstruction of justice, they cannot be sentenced to prison.",0,.,-2.398584485054016,-3.40580153465271,-1.0072170495986938,False
Rent must be paid on the first day of each month or late fees apply,Rent is not paid on the first day but no late fee applies,0, apply,2.799980640411377,-3.6938552856445312,-6.493835926055908,True
"If a person is found guilty of kidnapping, they can be sentenced to prison.","If a person is not found guilty of kidnapping, they cannot be sentenced to prison.",0,.,-2.0450121760368347,-2.968714714050293,-0.9237025380134583,False
"If a person is found guilty of human trafficking, they can be sentenced to prison.",A person is found guilty of human trafficking and they cannot be sentenced to prison.,1,.,-2.0109035968780518,-2.996584177017212,-0.9856805801391602,False
"If a person is found guilty of tax fraud, they can be ordered to pay back taxes.",A person is found guilty of tax fraud and they cannot be ordered to pay back taxes.,1,.,-1.3069244623184204,-2.387617349624634,-1.0806928873062134,False
"If you maintain a safe distance from other vehicles, you will reduce the risk of collisions.",You maintain a safe distance from other vehicles and you will not reduce the risk of collisions.,1,.,-0.1706249713897705,-1.317523717880249,-1.1468987464904785,False
"If a client cancels the service within the trial period, no charges will be applied.",The client doesn't cancel during trial yet doesn't get charged afterward either.,0,.,-0.3085971474647522,-0.8923150300979614,-0.5837178826332092,False
A deposit refund will be given if cancellation occurs within days of booking.,Cancellation happens after day period but a refund is still provided for deposit payment.,0,.,-0.13490211963653564,-1.3092141151428223,-1.1743119955062866,False
"If someone is found guilty, they will be sentenced.","If someone is not found guilty, they are not sentenced.",0,.,-2.290067434310913,-4.37850284576416,-2.088435411453247,False
"If an author doesn't deliver their manuscript by the deadline, they may lose their advance payment.",An author misses their manuscript deadline but doesn't lose their advance payment.,1,.,0.128135085105896,-1.1101911067962646,-1.2383261919021606,True
"If a person is found guilty of embezzlement, they can be sentenced to prison.","If a person is not found guilty of embezzlement, they cannot be sentenced to prison.",0,.,-2.3095083236694336,-3.3072192668914795,-0.9977109432220459,False
"If a person is found guilty of tax evasion, they can be sentenced to prison.","If a person is not found guilty of tax evasion, they cannot be sentenced to prison.",0,.,-2.191093921661377,-3.1889586448669434,-0.9978647232055664,False
"If a student does not maintain satisfactory academic progress, financial aid may be revoked.",A student maintains satisfactory academic progress yet loses their financial aid anyway.,0,.,-0.4094908833503723,-1.073103427886963,-0.6636125445365906,False
"If a person is found guilty of securities fraud, they can be ordered to pay restitution.",A person is found guilty of securities fraud and they cannot be ordered to pay restitution.,1,.,-0.9016026854515076,-1.8410736322402954,-0.9394709467887878,False
"If a person is found guilty of hate crime, they can be sentenced to prison.","If a person is not found guilty of hate crime, they cannot be sentenced to prison.",0,.,-1.8169545531272888,-2.732917070388794,-0.9159625172615051,False
"If an employee is found to have violated non-compete terms, legal action may follow.",An employee violates non-compete terms and faces no legal action,1,.,10.26537811756134,-0.5314215421676636,-10.796799659729004,True
"If a person files a false insurance claim, they can be charged with fraud.",A person files a false insurance claim and they cannot be charged with fraud.,1,.,-0.14457476139068604,-1.4276882410049438,-1.2831134796142578,False
"If you are charged with a crime, you have the right to a lawyer.",You are charged with a crime and you do not have the right to a lawyer.,1,.,-0.36716142296791077,-0.7653798460960388,-0.39821842312812805,False
"If a person is charged with a crime, they have the right to a speedy trial.",A person is charged with a crime and they do not have the right to a speedy trial.,1,.,0.36915504932403564,-1.0077191591262817,-1.3768742084503174,True
"If a person is found in contempt of court, they can be fined or jailed.","If a person is not found in contempt of court, they cannot be fined or jailed.",0,.,-0.7762720584869385,-1.909940242767334,-1.1336681842803955,False
"If a person is found guilty of domestic violence, they can be issued a restraining order.","If a person is not found guilty of domestic violence, they cannot be issued a restraining order.",0,.,-0.5163363218307495,-1.6676892042160034,-1.151352882385254,False
"If a person is found guilty of domestic violence, they can be issued a restraining order.",A person is found guilty of domestic violence and they cannot be issued a restraining order.,1,.,-0.6251585483551025,-1.6676892042160034,-1.0425306558609009,False
"If you update your will, your estate will be distributed according to your wishes.","If you do not update your will, your estate will be distributed according to your wishes.",0,.,-0.04299044609069824,-0.5709187984466553,-0.527928352355957,False
The client may terminate the contract if services are unsatisfactory.,Services are unsatisfactory but the client doesn't terminate the contract.,1,.,-0.03945636749267578,-1.2180125713348389,-1.178556203842163,False
"If a dispute arises from this agreement, it will be resolved by mediation first.",A dispute arises from this agreement but it's taken directly to court without mediation first,1,.,-0.19436782598495483,-0.8794863820075989,-0.685118556022644,False
"If a person is arrested, they have the right to remain silent.","If a person is not arrested, they have the right to remain silent.",0,.,-0.08356666564941406,-1.4298264980316162,-1.3462598323822021,False
"If a person signs a contract, they are legally bound to fulfill its terms.",A person signs a contract and they are not legally bound to fulfill its terms.,1,.,-0.23074007034301758,-0.9243818521499634,-0.6936417818069458,False
"If a person is found guilty of blackmail, they can be ordered to pay restitution.","If a person is not found guilty of blackmail, they cannot be ordered to pay restitution.",0,.,-0.6282932758331299,-1.632749319076538,-1.0044560432434082,False
"If a person files a false insurance claim, they can be charged with fraud.","If a person does not file a false insurance claim, they cannot be charged with fraud.",0,.,-0.2975848913192749,-1.4276882410049438,-1.130103349685669,False
"If a person is found guilty of murder, they can be sentenced to life in prison.",A person is found guilty of murder and they cannot be sentenced to life in prison.,1,.,-0.3628826141357422,-1.4502480030059814,-1.0873653888702393,False
"If a person is found guilty of racketeering, they can be ordered to forfeit assets.",A person is found guilty of racketeering and they cannot be ordered to forfeit assets.,1,.,-1.152333378791809,-2.314560890197754,-1.1622275114059448,False
"If you file for divorce, the court will review your case.","If you do not file for divorce, the court will review your case.",0,.,-0.14824748039245605,-1.678816795349121,-1.530569314956665,False
The buyer must inspect the goods upon delivery and report any defects within hours.,The buyer inspects the goods but does not report defects within the required hour window.,1,.,-0.7694435715675354,-1.7478951215744019,-0.9784515500068665,False
"If a person is found guilty of hacking, they can be sentenced to prison.",A person is found guilty of hacking and they cannot be sentenced to prison.,1,.,-1.9317816495895386,-3.060476779937744,-1.1286951303482056,False
"If someone testifies falsely, they are guilty of perjury.",Someone testifies falsely and they are not guilty of perjury.,1,.,0.04205155372619629,-0.6536685228347778,-0.6957200765609741,True
The contractor must obtain necessary permits before starting work on-site.,The contractor starts work on-site without obtaining necessary permits.,1,.,0.7182600498199463,-0.9339562654495239,-1.6522163152694702,True
"If a person has a restraining order against them, they must stay away from the protected party.","If a person does not have a restraining order against them, they do not need to stay away from the protected party.",0,.,-0.5455509424209595,-1.7624084949493408,-1.2168575525283813,False
"If the restaurant's food safety rating falls below a certain threshold, it may be shut down.",The restaurant maintains a high food safety rating yet is still forced to close without explanation.,0,.,-0.16979968547821045,-0.9132672548294067,-0.7434675693511963,False
"If any party breaches this agreement, it can be terminated immediately",A party breaches this agreement but it isn't terminated immediately,1, immediately,1.9530484676361084,-3.0836822986602783,-5.036730766296387,True
"If a person is found guilty of animal cruelty, they can be ordered to pay a fine.",A person is found guilty of animal cruelty and they cannot be ordered to pay a fine.,1,.,-2.589522421360016,-3.336752414703369,-0.7472299933433533,False
"If a speaker cancels their conference appearance, a replacement will be arranged.",The speaker doesn't cancel their appearance but the organizer still arranges an unnecessary replacement.,0,.,-0.16821277141571045,-1.2344733476638794,-1.066260576248169,False
"If you attend family therapy, your relationships may improve.","If you do not attend family therapy, your relationships may improve.",0,.,-0.1346677541732788,-1.1436039209365845,-1.0089361667633057,False
"If you meet your sales targets, you will receive a bonus.","If you do not meet your sales targets, you will receive a bonus.",0,.,-0.25341272354125977,-2.49873423576355,-2.24532151222229,False
"If you drive under the influence of alcohol, your license will be suspended.","If you do not drive under the influence of alcohol, your license will be suspended.",0,.,-0.1339280605316162,-1.3831150531768799,-1.2491869926452637,False
"If a witness is credible, their testimony is reliable.",A witness is credible and their testimony is not reliable.,1,.,-0.15211641788482666,-0.7461519241333008,-0.5940355062484741,False
The buyer must inspect the goods upon delivery and report any defects within hours.,The buyer reports defects even though they inspected and found no issues with delivered goods.,0,.,-1.2422068119049072,-1.7478951215744019,-0.5056883096694946,False
"If a person is found guilty of counterfeiting, they can be ordered to pay restitution.","If a person is not found guilty of counterfeiting, they cannot be ordered to pay restitution.",0,.,-0.8033761978149414,-1.8288654088974,-1.0254892110824585,False
"If a person is found not guilty by reason of insanity, they can be committed to a mental institution.",A person is found not guilty by reason of insanity and they cannot be committed to a mental institution.,1,.,-0.2076621651649475,-1.1449923515319824,-0.9373301863670349,False
Changes to project scope require written approval from both parties,Changes occur to project scope without written approval from both parties,1, parties,-0.6564254760742188,-4.4715776443481445,-3.815152168273926,False
"If you pay child support, the child's needs will be financially covered.","If you do not pay child support, the child's needs will be financially covered.",0,.,0.10256147384643555,-1.132165789604187,-1.2347272634506226,True
"If you steal something, you are a thief.","If you do not steal something, you are not a thief.",0,.,-0.0007787942886352539,-0.5777776837348938,-0.5769988894462585,False
A deposit refund will be given if cancellation occurs within days of booking.,Cancellation occurs within days and no deposit refund is given.,1,.,-0.45693105459213257,-1.3092141151428223,-0.8522830605506897,False
"If a person is found guilty of a misdemeanor, they can be sentenced to jail.",A person is found guilty of a misdemeanor and they cannot be sentenced to jail.,1,.,-2.0605071783065796,-3.4723587036132812,-1.4118515253067017,False
"If a contract is breached, the injured party can sue.","If a contract is not breached, the injured party can sue.",0,.,-0.11699628829956055,-3.4900569915771484,-3.373060703277588,False
"If a person is found guilty of credit card fraud, they can be ordered to pay restitution.",A person is found guilty of credit card fraud and they cannot be ordered to pay restitution.,1,.,-0.9278010129928589,-1.8346987962722778,-0.906897783279419,False
