sentence1,sentence2,label,target,nes,log_prob_aff,log_prob_neg,failure
"If a person is charged with a crime, they have the right to a speedy trial.","If a person is not charged with a crime, they do not have the right to a speedy trial.",0,.,-0.12120401859283447,-1.0077191591262817,-0.8865151405334473,False
"If a person is found guilty of stalking, they can be issued a restraining order.",A person is found guilty of stalking and they cannot be issued a restraining order.,1,.,-0.575165867805481,-1.6789144277572632,-1.1037485599517822,False
"If you use your turn signals, other drivers will be aware of your intentions.",You use your turn signals and other drivers will not be aware of your intentions.,1,.,-0.12882161140441895,-0.9027390480041504,-0.7739174365997314,False
The supplier must deliver goods on time for a discount to apply,The supplier does not deliver goods on time but still gets a discount,0, apply,5.846362113952637,-7.172398567199707,-13.018760681152344,True
"If you follow the visitation schedule, you can maintain a relationship with your child.",You follow the visitation schedule and you cannot maintain a relationship with your child.,1,.,-0.5056248903274536,-1.933783769607544,-1.4281588792800903,False
"If you adopt a child, you will have legal responsibility for their well-being.","If you do not adopt a child, you will have legal responsibility for their well-being.",0,.,-0.0003413558006286621,-0.7491730451583862,-0.7488316893577576,False
"If a person is arrested, they have the right to remain silent.",A person is arrested and they do not have the right to remain silent.,1,.,0.2961611747741699,-1.4298264980316162,-1.7259876728057861,True
"If a student does not maintain satisfactory academic progress, financial aid may be revoked.",A student does not maintain satisfactory academic progress but keeps receiving financial aid.,1,.,0.7897984981536865,-1.073103427886963,-1.8629019260406494,True
"If a person files a frivolous lawsuit, it can be dismissed.",A person files a frivolous lawsuit and it is not dismissed.,1,.,-0.8183765411376953,-1.8144237995147705,-0.9960472583770752,False
"If materials delivered are defective or damaged, they'll be replaced at no cost",Materials arrive in perfect condition and still get replaced for free,0, cost,6.705589830875397,-0.8648905158042908,-7.5704803466796875,True
"If a person is found guilty of vandalism, they can be ordered to pay restitution.","If a person is not found guilty of vandalism, they cannot be ordered to pay restitution.",0,.,-0.7105613946914673,-1.6470072269439697,-0.9364458322525024,False
