sentence1,sentence2,label,target,nes,log_prob_aff,log_prob_neg,failure
"If a person is found guilty of conspiracy, they can be sentenced to prison.",A person is found guilty of conspiracy and they cannot be sentenced to prison.,1,.,-2.075385570526123,-3.3394360542297363,-1.2640504837036133,False
"If a person is found guilty of hate crime, they can be sentenced to prison.",A person is found guilty of hate crime and they cannot be sentenced to prison.,1,.,-1.6599788665771484,-2.732917070388794,-1.0729382038116455,False
"If a person is found guilty of child abuse, they can lose custody of their child.",A person is found guilty of child abuse and they cannot lose custody of their child.,1,.,-0.38167452812194824,-1.668389916419983,-1.2867153882980347,False
"If a person is found guilty of copyright infringement, they can be ordered to pay damages.","If a person is not found guilty of copyright infringement, they cannot be ordered to pay damages.",0,.,-1.1943836212158203,-2.2917280197143555,-1.0973443984985352,False
The business shall provide proper safety training to employees,Business provides safety training but it's deemed improper by standards,1, employees,3.6253271102905273,-2.108725070953369,-5.7340521812438965,True
Rent must be paid on the first day of each month or late fees apply,Rent is paid on the first day of the month and late fees still apply,1, apply,-3.6175079867243767,-3.6938552856445312,-0.07634729892015457,False
"If a refund request is submitted before product delivery, a full refund will be issued",Refund request submitted after product delivery and still a full refund gets issued,0, issued,3.4372116327285767,-1.6838964223861694,-5.121108055114746,True
"If a person is found guilty of obstruction of justice, they can be sentenced to prison.",A person is found guilty of obstruction of justice and they cannot be sentenced to prison.,1,.,-2.360419511795044,-3.40580153465271,-1.045382022857666,False
"If both parties agree to an extension, deadlines can be extended","If one party does not agree to an extension, deadlines cannot be extended",0, extended,2.180722236633301,-2.39381742477417,-4.574539661407471,True
"If the employee does not meet sales targets, commission rates will be adjusted.",The employee meets or exceeds sales targets yet their commission rates are still adjusted downward.,0,.,-0.7688338756561279,-1.8805592060089111,-1.1117253303527832,False
"If a person is found guilty of selling counterfeit goods, they can be ordered to pay restitution.","If a person is not found guilty of selling counterfeit goods, they cannot be ordered to pay restitution.",0,.,-0.7629984617233276,-1.809749960899353,-1.0467514991760254,False
"If a person is found guilty of assault, they can be ordered to pay damages.",A person is found guilty of assault and they cannot be ordered to pay damages.,1,.,-1.021651268005371,-2.0857133865356445,-1.0640621185302734,False
"If a defendant is acquitted, they cannot be retried for the same crime.",A defendant is acquitted and they can be retried for the same crime.,1,.,0.022333621978759766,-0.950559139251709,-0.9728927612304688,True
"If a person is evicted, they must leave their residence.",A person is evicted and they do not need to leave their residence.,1,.,-0.3838609457015991,-2.083197593688965,-1.6993366479873657,False
"If a person is found guilty of intellectual property theft, they can be ordered to pay damages.","If a person is not found guilty of intellectual property theft, they cannot be ordered to pay damages.",0,.,-1.0752875804901123,-2.2662153244018555,-1.1909277439117432,False
"If you have joint custody, you will share decision-making responsibilities.","If you do not have joint custody, you will share decision-making responsibilities.",0,.,-0.05096602439880371,-2.5897645950317383,-2.5387985706329346,False
"If a borrower defaults on their loan, the lender may seize collateral.",The borrower defaults on their loan but the lender does not seize collateral.,1,.,-1.255238652229309,-2.6157307624816895,-1.3604921102523804,False
The business shall provide proper safety training to employees,No safety training provided yet employees already have proper skills in place,0, employees,7.849974155426025,-2.108725070953369,-9.958699226379395,True
Studying hard will result in good grades,Studying hard but not getting good grades,1, grades,-0.10252052545547485,-0.6115409135818481,-0.5090203881263733,False
"If a person is found guilty of securities fraud, they can be ordered to pay restitution.","If a person is not found guilty of securities fraud, they cannot be ordered to pay restitution.",0,.,-0.7399119138717651,-1.8410736322402954,-1.1011617183685303,False
"If the work isn't completed in time, penalties apply.",The work is completed on time yet penalties still apply.,0,.,0.3335636258125305,-0.84046870470047,-1.1740323305130005,True
"If a person is evicted, they must leave their residence.","If a person is not evicted, they do not need to leave their residence.",0,.,-0.6526002883911133,-2.083197593688965,-1.4305973052978516,False
"If a person commits a crime, they will be punished.","If a person does not commit a crime, they are punished.",0,.,0.10162591934204102,-2.924654483795166,-3.026280403137207,True
"If a customer finds a lower price elsewhere within days, the store will match the price.",The customer doesn't find any lower prices elsewhere but still requests a price reduction.,0,.,-0.7415538430213928,-1.667229175567627,-0.9256753325462341,False
"If you maintain a safe distance from other vehicles, you will reduce the risk of collisions.","If you do not maintain a safe distance from other vehicles, you will reduce the risk of collisions.",0,.,-0.11203563213348389,-1.317523717880249,-1.2054880857467651,False
"If a person is found guilty of kidnapping, they can be sentenced to prison.",A person is found guilty of kidnapping and they cannot be sentenced to prison.,1,.,-1.8533291816711426,-2.968714714050293,-1.1153855323791504,False
"If a client cancels the service within the trial period, no charges will be applied.",The client cancels the service within the trial period but still gets charged.,1,.,1.7884520292282104,-0.8923150300979614,-2.680767059326172,True
"If a person is convicted of a crime, they have a criminal record.",A person is convicted of a crime and they do not have a criminal record.,1,.,-0.31684809923171997,-1.14841890335083,-0.8315708041191101,False
"If a dispute arises from this agreement, it will be resolved by mediation first.",No dispute arises from this agreement yet parties still engage in mediation,0,.,7.488968551158905,-0.8794863820075989,-8.368454933166504,True
"If subcontractors are used, they must be approved by the client",No subcontractors are used but still need approval from the client,0, client,-0.9535589218139648,-8.464970588684082,-7.511411666870117,False
"If a person is found guilty of racketeering, they can be sentenced to prison.","If a person is not found guilty of racketeering, they cannot be sentenced to prison.",0,.,-2.2592427730560303,-3.2130627632141113,-0.953819990158081,False
"If a person is found guilty of insider trading, they can be sentenced to prison.",A person is found guilty of insider trading and they cannot be sentenced to prison.,1,.,-1.8017387986183167,-2.7817018032073975,-0.9799630045890808,False
Changes to project scope require written approval from both parties,No changes occur to project scope but still need written approval from both parties,0, parties,-0.9971911907196045,-4.4715776443481445,-3.47438645362854,False
"If you exercise regularly and eat healthy, you will lose weight","If you don't exercise regularly and eat healthy, you will lose weight",0, weight,-0.13311177492141724,-0.7674017548561096,-0.6342899799346924,False
"If a refund request is submitted before product delivery, a full refund will be issued",Refund request submitted before product delivery but no refund issued,1, issued,4.2912517786026,-1.6838964223861694,-5.9751482009887695,True
"If a person is found guilty of smuggling, they can be sentenced to prison.","If a person is not found guilty of smuggling, they cannot be sentenced to prison.",0,.,-2.143040418624878,-3.0770161151885986,-0.9339756965637207,False
"If a person is found guilty of animal cruelty, they can be ordered to pay a fine.","If a person is not found guilty of animal cruelty, they cannot be ordered to pay a fine.",0,.,-2.3280798196792603,-3.336752414703369,-1.0086725950241089,False
"If you park in a no-parking zone, your car will be towed.","If you do not park in a no-parking zone, your car will be towed.",0,.,-0.16230034828186035,-1.5525660514831543,-1.390265703201294,False
"If a person is found guilty of arson, they can be sentenced to prison.","If a person is not found guilty of arson, they cannot be sentenced to prison.",0,.,-2.2980453968048096,-3.2510786056518555,-0.9530332088470459,False
"If a person is held in contempt of court, they can be punished.","If a person is not held in contempt of court, they are not punished.",0,.,-2.660614848136902,-4.546154499053955,-1.8855396509170532,False
"If a person is found guilty of tax evasion, they can be sentenced to prison.",A person is found guilty of tax evasion and they cannot be sentenced to prison.,1,.,-2.105228066444397,-3.1889586448669434,-1.0837305784225464,False
"If a person is found guilty of trespassing, they can be ordered to pay a fine.",A person is found guilty of trespassing and they cannot be ordered to pay a fine.,1,.,-2.641973853111267,-3.428532600402832,-0.7865587472915649,False
"If termination occurs without cause, a severance package will be provided.",Termination occurs with cause and still a severance package is provided.,0,.,-0.6813657283782959,-1.9370938539505005,-1.2557281255722046,False
"If a person is convicted of a felony, they lose certain rights.",A person is convicted of a felony and they do not lose certain rights.,1,.,-0.09255421161651611,-1.8255293369293213,-1.7329751253128052,False
"If an author doesn't deliver their manuscript by the deadline, they may lose their advance payment.",An author delivers their manuscript on time yet still loses their advance payment for no apparent reason.,0,.,-0.5639682412147522,-1.1101911067962646,-0.5462228655815125,False
"If a person is granted power of attorney, they can make decisions on behalf of another person.",A person is granted power of attorney and they cannot make decisions on behalf of another person.,1,.,-0.7506471872329712,-2.1627705097198486,-1.4121233224868774,False
"If a search warrant is issued, it must be based on probable cause.","If a search warrant is not issued, it does not need to be based on probable cause.",0,.,-0.3732619881629944,-1.1193408966064453,-0.7460789084434509,False
"If a person is found guilty of racketeering, they can be ordered to forfeit assets.","If a person is not found guilty of racketeering, they cannot be ordered to forfeit assets.",0,.,-0.8531925678253174,-2.314560890197754,-1.4613683223724365,False
"If a person is under arrest, they must be read their Miranda rights.","If a person is not under arrest, they do not need to be read their Miranda rights.",0,.,-0.3079410791397095,-1.3385385274887085,-1.030597448348999,False
"If a person is found guilty of drug possession, they can be sentenced to prison.","If a person is not found guilty of drug possession, they cannot be sentenced to prison.",0,.,-2.27718847990036,-3.2157304286956787,-0.9385419487953186,False
"If a party fails to meet obligations under this agreement, it may result in contract termination.",A party fails to meet obligations and the contract isn't terminated.,1,.,0.32195472717285156,-1.1972169876098633,-1.5191717147827148,True
"If a defendant is acquitted, they cannot be retried for the same crime.","If a defendant is not acquitted, they cannot be retried for the same crime.",0,.,-0.07260555028915405,-0.950559139251709,-0.8779535889625549,False
Taking breaks during work increases productivity,Not taking breaks during work increases productivity,0, productivity,-0.5716140270233154,-3.2167251110076904,-2.645111083984375,False
"If a search warrant is issued, it must be based on probable cause.",A search warrant is issued and it is not based on probable cause.,1,.,-0.260231077671051,-1.1193408966064453,-0.8591098189353943,False
"If a person is found guilty of embezzlement, they can be sentenced to prison.",A person is found guilty of embezzlement and they cannot be sentenced to prison.,1,.,-2.2409825325012207,-3.3072192668914795,-1.0662367343902588,False
"If a person is found guilty of money laundering, they can be ordered to pay a fine.","If a person is not found guilty of money laundering, they cannot be ordered to pay a fine.",0,.,-2.364753484725952,-3.461240530014038,-1.096487045288086,False
"If a person is found guilty of forgery, they can be ordered to pay restitution.","If a person is not found guilty of forgery, they cannot be ordered to pay restitution.",0,.,-0.867292046546936,-1.9995124340057373,-1.1322203874588013,False
"If you park in a no-parking zone, your car will be towed.",You park in a no-parking zone and your car will not be towed.,1,.,-0.8218041062355042,-1.5525660514831543,-0.7307619452476501,False
"If a person is convicted of a felony, they lose certain rights.","If a person is not convicted of a felony, they do not lose certain rights.",0,.,-0.12621521949768066,-1.8255293369293213,-1.6993141174316406,False
"If you have joint custody, you will share decision-making responsibilities.",You have joint custody and you will not share decision-making responsibilities.,1,.,-0.5748310089111328,-2.5897645950317383,-2.0149335861206055,False
"If a person is found guilty of mortgage fraud, they can be ordered to pay restitution.",A person is found guilty of mortgage fraud and they cannot be ordered to pay restitution.,1,.,-0.9214596748352051,-1.827663779258728,-0.906204104423523,False
"If a party fails to provide notice of termination, automatic renewal occurs",A party provides proper notice of termination but still faces automatic renewal.,0, occurs,4.484871864318848,-9.017354011535645,-13.502225875854492,True
All disputes arising out of this contract shall be resolved through arbitration,Dispute arises out of contract yet isn't resolved through arbitration,1, arbitration,1.4130442142486572,-1.143012523651123,-2.5560567378997803,True
"If a person is found guilty of mail fraud, they can be sentenced to prison.","If a person is not found guilty of mail fraud, they cannot be sentenced to prison.",0,.,-2.1069478392601013,-3.039271354675293,-0.9323235154151917,False
"If a person is found guilty of conspiracy, they can be sentenced to prison.","If a person is not found guilty of conspiracy, they cannot be sentenced to prison.",0,.,-2.322532057762146,-3.3394360542297363,-1.0169039964675903,False
"If a person is found guilty of bribery, they can be ordered to pay a fine.","If a person is not found guilty of bribery, they cannot be ordered to pay a fine.",0,.,-2.2572526931762695,-3.2878832817077637,-1.0306305885314941,False
"If a person is found guilty of computer hacking, they can be ordered to pay restitution.",A person is found guilty of computer hacking and they cannot be ordered to pay restitution.,1,.,-0.8814120292663574,-1.783086895942688,-0.9016748666763306,False
"If a person is found guilty of harassment, they can be issued a restraining order.",A person is found guilty of harassment and they cannot be issued a restraining order.,1,.,-0.5410425662994385,-1.6314616203308105,-1.090419054031372,False
"If the client is not satisfied with the final product, revisions will be made.",The client is satisfied with the final product but requests revisions anyway.,0,.,-1.5887318551540375,-2.0437512397766113,-0.45501938462257385,False
"If a person is found guilty of bribery, they can be ordered to pay a fine.",A person is found guilty of bribery and they cannot be ordered to pay a fine.,1,.,-2.524649739265442,-3.2878832817077637,-0.7632335424423218,False
"If a witness is credible, their testimony is reliable.","If a witness is not credible, their testimony is not reliable.",0,.,-0.059311866760253906,-0.7461519241333008,-0.6868400573730469,False
"If a person is found guilty of stalking, they can be issued a restraining order.","If a person is not found guilty of stalking, they cannot be issued a restraining order.",0,.,-0.4612802267074585,-1.6789144277572632,-1.2176342010498047,False
"If a tenant breaks any lease terms, eviction proceedings may commence.",A tenant breaks lease terms but eviction proceedings do not commence.,1,.,-0.018271923065185547,-2.0506129264831543,-2.0323410034179688,False
"If you update your will, your estate will be distributed according to your wishes.",You update your will and your estate will not be distributed according to your wishes.,1,.,-0.06877642869949341,-0.5709187984466553,-0.5021423697471619,False
"If a person is found guilty of forgery, they can be sentenced to prison.","If a person is not found guilty of forgery, they cannot be sentenced to prison.",0,.,-2.3822784423828125,-3.484534740447998,-1.1022562980651855,False
"If a person is granted parole, they can be released from prison early.","If a person is not granted parole, they cannot be released from prison early.",0,.,-0.5162050724029541,-1.9177606105804443,-1.4015555381774902,False
"If a person commits a crime, they will be punished.",A person commits a crime and they are not punished.,1,.,-1.134711503982544,-2.924654483795166,-1.789942979812622,False
"If a person is granted parole, they can be released from prison early.",A person is granted parole and they cannot be released from prison early.,1,.,-0.6619713306427002,-1.9177606105804443,-1.2557892799377441,False
"If a person is found guilty of mortgage fraud, they can be ordered to pay restitution.","If a person is not found guilty of mortgage fraud, they cannot be ordered to pay restitution.",0,.,-0.7744191884994507,-1.827663779258728,-1.0532445907592773,False
"If a person signs a contract, they are legally bound to fulfill its terms.","If a person does not sign a contract, they are not legally bound to fulfill its terms.",0,.,-0.2828493118286133,-0.9243818521499634,-0.6415325403213501,False
"If a person is found guilty of human trafficking, they can be sentenced to prison.","If a person is not found guilty of human trafficking, they cannot be sentenced to prison.",0,.,-2.1205520629882812,-2.996584177017212,-0.8760321140289307,False
"If any party breaches this agreement, it can be terminated immediately",No parties breach this agreement yet it's still terminated immediately,0, immediately,1.4927098751068115,-3.0836822986602783,-4.57639217376709,True
Saving money consistently will help you build wealth,Not saving money consistently will help you build wealth,0, wealth,0.7755610942840576,-3.504321813583374,-4.279882907867432,True
Licenses granted under this agreement shall remain valid unless revoked in writing by licensor,Licenses remain valid even after being revoked in writing by licensor,1,or,0.5907759368419647,-0.33268365263938904,-0.9234595894813538,True
"If a law is unconstitutional, it will be struck down.",A law is unconstitutional and it is not struck down.,1,.,-0.2915494441986084,-1.4016571044921875,-1.110107660293579,False
"If the restaurant's food safety rating falls below a certain threshold, it may be shut down.",The restaurant's food safety rating falls below the threshold but it isn't shut down.,1,.,0.35569822788238525,-0.9132672548294067,-1.268965482711792,True
"If payment isn't received by due date, services may be suspended.",Payment is received by due date but services get suspended anyway.,0,.,-0.9036805629730225,-1.59959077835083,-0.6959102153778076,False
"If a person is found guilty of copyright infringement, they can be ordered to pay damages.",A person is found guilty of copyright infringement and they cannot be ordered to pay damages.,1,.,-1.4116787910461426,-2.2917280197143555,-0.8800492286682129,False
"If a person is found guilty of wage theft, they can be ordered to pay back wages.","If a person is not found guilty of wage theft, they cannot be ordered to pay back wages.",0,.,-1.357810616493225,-2.8256003856658936,-1.4677897691726685,False
"If you follow traffic signals, you will avoid accidents.","If you do not follow traffic signals, you will avoid accidents.",0,.,-0.11841678619384766,-1.2006406784057617,-1.082223892211914,False
"If you exceed the speed limit, you will be fined.","If you do not exceed the speed limit, you will be fined.",0,.,0.2737917900085449,-2.376800775527954,-2.650592565536499,True
"If a party fails to provide notice of termination, automatic renewal occurs",A party fails to provide notice of termination and no automatic renewal occurs.,1, occurs,3.056793212890625,-9.017354011535645,-12.07414722442627,True
"If a person is granted asylum, they can stay in the country legally.","If a person is not granted asylum, they cannot stay in the country legally.",0,.,-0.817681074142456,-2.0874743461608887,-1.2697932720184326,False
"If the client provides all necessary documents, the process is expedited.",The client does not provide all necessary documents and yet the process is expedited.,0,.,-0.2586008310317993,-1.2897377014160156,-1.0311368703842163,False
"If software license fees are not paid annually, access to the software may be revoked.",Software license fees are paid on time yet access to the software is still revoked without reason.,0,.,-0.4615459740161896,-0.9004565477371216,-0.438910573720932,False
"If you obey the traffic rules, you will not be fined.","If you do not obey the traffic rules, you will not be fined.",0,.,0.0007641911506652832,-0.9085205793380737,-0.909284770488739,True
"If an employee is found to have violated non-compete terms, legal action may follow.",An employee complies with non-compete terms but still faces legal action,0,.,8.935089230537415,-0.5314215421676636,-9.466510772705078,True
"If a person is found guilty of DUI, their driver's license can be suspended.","If a person is not found guilty of DUI, their driver's license is not suspended.",0,.,-0.981998085975647,-2.3613877296447754,-1.3793896436691284,False
"If a person is granted diplomatic immunity, they cannot be prosecuted for crimes.","If a person is not granted diplomatic immunity, they can be prosecuted for crimes.",0,.,-0.016491413116455078,-3.911497116088867,-3.895005702972412,False
"If a person is found guilty of bank robbery, they can be sentenced to prison.",A person is found guilty of bank robbery and they cannot be sentenced to prison.,1,.,-2.0790903568267822,-3.160193681716919,-1.0811033248901367,False
"If a person is found guilty of assault, they can be ordered to pay damages.","If a person is not found guilty of assault, they cannot be ordered to pay damages.",0,.,-0.9562212228775024,-2.0857133865356445,-1.129492163658142,False
"If you establish paternity, you will have legal rights to the child.","If you do not establish paternity, you will have legal rights to the child.",0,.,0.023863554000854492,-1.0509285926818848,-1.0747921466827393,True
"If an employer discriminates against an employee, they can be sued.","If an employer does not discriminate against an employee, they cannot be sued.",0,.,0.25964832305908203,-2.1334939002990723,-2.3931422233581543,True
"If you sign the contract, you will receive benefits.","If you do not sign the contract, you will receive benefits.",0,.,-0.40488767623901367,-2.9442455768585205,-2.539357900619507,False
"If you provide a medical certificate, you will be granted sick leave.","If you do not provide a medical certificate, you will be granted sick leave.",0,.,-0.2281041145324707,-1.3132330179214478,-1.085128903388977,False
"If a person has a restraining order against them, they must stay away from the protected party.",A person has a restraining order against them and they do not need to stay away from the protected party.,1,.,-0.6245218515396118,-1.7624084949493408,-1.137886643409729,False
"If a person is found guilty beyond a reasonable doubt, they can be convicted.",A person is found guilty beyond a reasonable doubt and they cannot be convicted.,1,.,-1.5595617294311523,-4.648562908172607,-3.089001178741455,False
"If a person is found guilty beyond a reasonable doubt, they can be convicted.","If a person is not found guilty beyond a reasonable doubt, they cannot be convicted.",0,.,-2.3428893089294434,-4.648562908172607,-2.305673599243164,False
"If a person is found guilty of money laundering, they can be sentenced to prison.",A person is found guilty of money laundering and they cannot be sentenced to prison.,1,.,-2.246521234512329,-3.3706984519958496,-1.1241772174835205,False
"If a person is found guilty of identity theft, they can be ordered to pay restitution.","If a person is not found guilty of identity theft, they cannot be ordered to pay restitution.",0,.,-0.8046168088912964,-1.8939672708511353,-1.0893504619598389,False
"If you provide evidence of abuse, the court may grant a restraining order.",You provide evidence of abuse and the court may not grant a restraining order.,1,.,-0.49297213554382324,-1.9225252866744995,-1.4295531511306763,False
"If a person is found not guilty by reason of insanity, they can be committed to a mental institution.","If a person is not found not guilty by reason of insanity, they cannot be committed to a mental institution.",0,.,-0.18353325128555298,-1.1449923515319824,-0.9614591002464294,False
The provider must give days' notice before terminating the contract.,The provider gives less than days' notice before terminating the contract.,1,.,0.02248227596282959,-1.1252455711364746,-1.1477278470993042,True
"If a person files a frivolous lawsuit, it can be dismissed.","If a person does not file a frivolous lawsuit, it is not dismissed.",0,.,-0.7488617897033691,-1.8144237995147705,-1.0655620098114014,False
